No.     Time        Source                Destination           Protocol Length Info
      1 0.000000    192.168.1.120         192.168.1.120         TCP      60     15977 > http [SYN] Seq=0 Win=800 Len=0 MSS=512

Frame 1: 60 bytes on wire (480 bits), 60 bytes captured (480 bits)
Ethernet II, Src: Intel-Hf_14:c8:00 (00:a0:c9:14:c8:00), Dst: CompalIn_81:b4:ab (XX:XX:XX:XX:XX:XX)
    Destination: CompalIn_81:b4:ab (XX:XX:XX:XX:XX:XX)
    Source: Intel-Hf_14:c8:00 (00:a0:c9:14:c8:00)
    Type: IP (0x0800)
    Trailer: 0400
Internet Protocol Version 4, Src: 192.168.1.153 (192.168.1.153), Dst: 192.168.1.120 (192.168.1.120)
Transmission Control Protocol, Src Port: 15977 (15977), Dst Port: http (80), Seq: 0, Len: 0

No.     Time        Source                Destination           Protocol Length Info
      2 0.000215    192.168.1.153         192.168.1.153         TCP      58     http > 15977 [SYN, ACK] Seq=0 Ack=1 Win=8192 Len=0 MSS=1460

Frame 2: 58 bytes on wire (464 bits), 58 bytes captured (464 bits)
Ethernet II, Src: CompalIn_81:b4:ab (XX:XX:XX:XX:XX:XX), Dst: Intel-Hf_14:c8:00 (00:a0:c9:14:c8:00)
    Destination: Intel-Hf_14:c8:00 (00:a0:c9:14:c8:00)
    Source: CompalIn_81:b4:ab (XX:XX:XX:XX:XX:XX)
    Type: IP (0x0800)
Internet Protocol Version 4, Src: 192.168.1.120 (192.168.1.120), Dst: 192.168.1.153 (192.168.1.153)
Transmission Control Protocol, Src Port: http (80), Dst Port: 15977 (15977), Seq: 0, Ack: 1, Len: 0

No.     Time        Source                Destination           Protocol Length Info
      3 2.695902    192.168.1.120         192.168.1.120         TCP      60     15977 > http [ACK] Seq=1 Ack=1 Win=8192 Len=0

Frame 3: 60 bytes on wire (480 bits), 60 bytes captured (480 bits)
Ethernet II, Src: Intel-Hf_14:c8:00 (00:a0:c9:14:c8:00), Dst: CompalIn_81:b4:ab (XX:XX:XX:XX:XX:XX)
    Destination: CompalIn_81:b4:ab (XX:XX:XX:XX:XX:XX)
    Source: Intel-Hf_14:c8:00 (00:a0:c9:14:c8:00)
    Type: IP (0x0800)
    Trailer: 020000000000
Internet Protocol Version 4, Src: 192.168.1.153 (192.168.1.153), Dst: 192.168.1.120 (192.168.1.120)
Transmission Control Protocol, Src Port: 15977 (15977), Dst Port: http (80), Seq: 1, Ack: 1, Len: 0

No.     Time        Source                Destination           Protocol Length Info
      4 2.698440    192.168.1.120         192.168.1.120         HTTP     128    GET / HTTP/1.1 

Frame 4: 128 bytes on wire (1024 bits), 128 bytes captured (1024 bits)
Ethernet II, Src: Intel-Hf_14:c8:00 (00:a0:c9:14:c8:00), Dst: CompalIn_81:b4:ab (XX:XX:XX:XX:XX:XX)
    Destination: CompalIn_81:b4:ab (XX:XX:XX:XX:XX:XX)
    Source: Intel-Hf_14:c8:00 (00:a0:c9:14:c8:00)
    Type: IP (0x0800)
    Trailer: 78
Internet Protocol Version 4, Src: 192.168.1.153 (192.168.1.153), Dst: 192.168.1.120 (192.168.1.120)
Transmission Control Protocol, Src Port: 15977 (15977), Dst Port: http (80), Seq: 1, Ack: 1, Len: 73
Hypertext Transfer Protocol

No.     Time        Source                Destination           Protocol Length Info
      5 2.703238    192.168.1.153         192.168.1.153         TCP      590    [TCP segment of a reassembled PDU]

Frame 5: 590 bytes on wire (4720 bits), 590 bytes captured (4720 bits)
Ethernet II, Src: CompalIn_81:b4:ab (XX:XX:XX:XX:XX:XX), Dst: Intel-Hf_14:c8:00 (00:a0:c9:14:c8:00)
    Destination: Intel-Hf_14:c8:00 (00:a0:c9:14:c8:00)
    Source: CompalIn_81:b4:ab (XX:XX:XX:XX:XX:XX)
    Type: IP (0x0800)
Internet Protocol Version 4, Src: 192.168.1.120 (192.168.1.120), Dst: 192.168.1.153 (192.168.1.153)
Transmission Control Protocol, Src Port: http (80), Dst Port: 15977 (15977), Seq: 1, Ack: 74, Len: 536

No.     Time        Source                Destination           Protocol Length Info
      6 2.703248    192.168.1.153         192.168.1.153         TCP      590    [TCP segment of a reassembled PDU]

Frame 6: 590 bytes on wire (4720 bits), 590 bytes captured (4720 bits)
Ethernet II, Src: CompalIn_81:b4:ab (XX:XX:XX:XX:XX:XX), Dst: Intel-Hf_14:c8:00 (00:a0:c9:14:c8:00)
    Destination: Intel-Hf_14:c8:00 (00:a0:c9:14:c8:00)
    Source: CompalIn_81:b4:ab (XX:XX:XX:XX:XX:XX)
    Type: IP (0x0800)
Internet Protocol Version 4, Src: 192.168.1.120 (192.168.1.120), Dst: 192.168.1.153 (192.168.1.153)
Transmission Control Protocol, Src Port: http (80), Dst Port: 15977 (15977), Seq: 537, Ack: 74, Len: 536

No.     Time        Source                Destination           Protocol Length Info
      7 7.767451    192.168.1.120         192.168.1.120         TCP      60     15977 > http [ACK] Seq=74 Ack=537 Win=16616 Len=0

Frame 7: 60 bytes on wire (480 bits), 60 bytes captured (480 bits)
Ethernet II, Src: Intel-Hf_14:c8:00 (00:a0:c9:14:c8:00), Dst: CompalIn_81:b4:ab (XX:XX:XX:XX:XX:XX)
    Destination: CompalIn_81:b4:ab (XX:XX:XX:XX:XX:XX)
    Source: Intel-Hf_14:c8:00 (00:a0:c9:14:c8:00)
    Type: IP (0x0800)
    Trailer: 470000000000
Internet Protocol Version 4, Src: 192.168.1.153 (192.168.1.153), Dst: 192.168.1.120 (192.168.1.120)
Transmission Control Protocol, Src Port: 15977 (15977), Dst Port: http (80), Seq: 74, Ack: 537, Len: 0

No.     Time        Source                Destination           Protocol Length Info
      8 7.767541    192.168.1.153         192.168.1.153         TCP      590    [TCP segment of a reassembled PDU]

Frame 8: 590 bytes on wire (4720 bits), 590 bytes captured (4720 bits)
Ethernet II, Src: CompalIn_81:b4:ab (XX:XX:XX:XX:XX:XX), Dst: Intel-Hf_14:c8:00 (00:a0:c9:14:c8:00)
    Destination: Intel-Hf_14:c8:00 (00:a0:c9:14:c8:00)
    Source: CompalIn_81:b4:ab (XX:XX:XX:XX:XX:XX)
    Type: IP (0x0800)
Internet Protocol Version 4, Src: 192.168.1.120 (192.168.1.120), Dst: 192.168.1.153 (192.168.1.153)
Transmission Control Protocol, Src Port: http (80), Dst Port: 15977 (15977), Seq: 1073, Ack: 74, Len: 536

No.     Time        Source                Destination           Protocol Length Info
      9 7.767549    192.168.1.153         192.168.1.153         TCP      590    [TCP segment of a reassembled PDU]

Frame 9: 590 bytes on wire (4720 bits), 590 bytes captured (4720 bits)
Ethernet II, Src: CompalIn_81:b4:ab (XX:XX:XX:XX:XX:XX), Dst: Intel-Hf_14:c8:00 (00:a0:c9:14:c8:00)
    Destination: Intel-Hf_14:c8:00 (00:a0:c9:14:c8:00)
    Source: CompalIn_81:b4:ab (XX:XX:XX:XX:XX:XX)
    Type: IP (0x0800)
Internet Protocol Version 4, Src: 192.168.1.120 (192.168.1.120), Dst: 192.168.1.153 (192.168.1.153)
Transmission Control Protocol, Src Port: http (80), Dst Port: 15977 (15977), Seq: 1609, Ack: 74, Len: 536

No.     Time        Source                Destination           Protocol Length Info
     10 10.746569   192.168.1.120         192.168.1.120         TCP      60     15977 > http [ACK] Seq=74 Ack=1073 Win=16616 Len=0

Frame 10: 60 bytes on wire (480 bits), 60 bytes captured (480 bits)
Ethernet II, Src: Intel-Hf_14:c8:00 (00:a0:c9:14:c8:00), Dst: CompalIn_81:b4:ab (XX:XX:XX:XX:XX:XX)
    Destination: CompalIn_81:b4:ab (XX:XX:XX:XX:XX:XX)
    Source: Intel-Hf_14:c8:00 (00:a0:c9:14:c8:00)
    Type: IP (0x0800)
    Trailer: 470000000000
Internet Protocol Version 4, Src: 192.168.1.153 (192.168.1.153), Dst: 192.168.1.120 (192.168.1.120)
Transmission Control Protocol, Src Port: 15977 (15977), Dst Port: http (80), Seq: 74, Ack: 1073, Len: 0

No.     Time        Source                Destination           Protocol Length Info
     11 10.746671   192.168.1.153         192.168.1.153         TCP      590    [TCP segment of a reassembled PDU]

Frame 11: 590 bytes on wire (4720 bits), 590 bytes captured (4720 bits)
Ethernet II, Src: CompalIn_81:b4:ab (XX:XX:XX:XX:XX:XX), Dst: Intel-Hf_14:c8:00 (00:a0:c9:14:c8:00)
    Destination: Intel-Hf_14:c8:00 (00:a0:c9:14:c8:00)
    Source: CompalIn_81:b4:ab (XX:XX:XX:XX:XX:XX)
    Type: IP (0x0800)
Internet Protocol Version 4, Src: 192.168.1.120 (192.168.1.120), Dst: 192.168.1.153 (192.168.1.153)
Transmission Control Protocol, Src Port: http (80), Dst Port: 15977 (15977), Seq: 2145, Ack: 74, Len: 536

No.     Time        Source                Destination           Protocol Length Info
     12 10.746677   192.168.1.153         192.168.1.153         TCP      590    [TCP segment of a reassembled PDU]

Frame 12: 590 bytes on wire (4720 bits), 590 bytes captured (4720 bits)
Ethernet II, Src: CompalIn_81:b4:ab (XX:XX:XX:XX:XX:XX), Dst: Intel-Hf_14:c8:00 (00:a0:c9:14:c8:00)
    Destination: Intel-Hf_14:c8:00 (00:a0:c9:14:c8:00)
    Source: CompalIn_81:b4:ab (XX:XX:XX:XX:XX:XX)
    Type: IP (0x0800)
Internet Protocol Version 4, Src: 192.168.1.120 (192.168.1.120), Dst: 192.168.1.153 (192.168.1.153)
Transmission Control Protocol, Src Port: http (80), Dst Port: 15977 (15977), Seq: 2681, Ack: 74, Len: 536

No.     Time        Source                Destination           Protocol Length Info
     13 14.100051   192.168.1.120         192.168.1.120         TCP      60     15977 > http [ACK] Seq=74 Ack=1609 Win=16616 Len=0

Frame 13: 60 bytes on wire (480 bits), 60 bytes captured (480 bits)
Ethernet II, Src: Intel-Hf_14:c8:00 (00:a0:c9:14:c8:00), Dst: CompalIn_81:b4:ab (XX:XX:XX:XX:XX:XX)
    Destination: CompalIn_81:b4:ab (XX:XX:XX:XX:XX:XX)
    Source: Intel-Hf_14:c8:00 (00:a0:c9:14:c8:00)
    Type: IP (0x0800)
    Trailer: 470000000000
Internet Protocol Version 4, Src: 192.168.1.153 (192.168.1.153), Dst: 192.168.1.120 (192.168.1.120)
Transmission Control Protocol, Src Port: 15977 (15977), Dst Port: http (80), Seq: 74, Ack: 1609, Len: 0

No.     Time        Source                Destination           Protocol Length Info
     14 14.100154   192.168.1.153         192.168.1.153         TCP      590    [TCP segment of a reassembled PDU]

Frame 14: 590 bytes on wire (4720 bits), 590 bytes captured (4720 bits)
Ethernet II, Src: CompalIn_81:b4:ab (XX:XX:XX:XX:XX:XX), Dst: Intel-Hf_14:c8:00 (00:a0:c9:14:c8:00)
    Destination: Intel-Hf_14:c8:00 (00:a0:c9:14:c8:00)
    Source: CompalIn_81:b4:ab (XX:XX:XX:XX:XX:XX)
    Type: IP (0x0800)
Internet Protocol Version 4, Src: 192.168.1.120 (192.168.1.120), Dst: 192.168.1.153 (192.168.1.153)
Transmission Control Protocol, Src Port: http (80), Dst Port: 15977 (15977), Seq: 3217, Ack: 74, Len: 536

No.     Time        Source                Destination           Protocol Length Info
     15 14.100160   192.168.1.153         192.168.1.153         TCP      590    [TCP segment of a reassembled PDU]

Frame 15: 590 bytes on wire (4720 bits), 590 bytes captured (4720 bits)
Ethernet II, Src: CompalIn_81:b4:ab (XX:XX:XX:XX:XX:XX), Dst: Intel-Hf_14:c8:00 (00:a0:c9:14:c8:00)
    Destination: Intel-Hf_14:c8:00 (00:a0:c9:14:c8:00)
    Source: CompalIn_81:b4:ab (XX:XX:XX:XX:XX:XX)
    Type: IP (0x0800)
Internet Protocol Version 4, Src: 192.168.1.120 (192.168.1.120), Dst: 192.168.1.153 (192.168.1.153)
Transmission Control Protocol, Src Port: http (80), Dst Port: 15977 (15977), Seq: 3753, Ack: 74, Len: 536

No.     Time        Source                Destination           Protocol Length Info
     16 22.196005   192.168.1.120         192.168.1.120         TCP      60     15977 > http [ACK] Seq=74 Ack=2145 Win=16616 Len=0

Frame 16: 60 bytes on wire (480 bits), 60 bytes captured (480 bits)
Ethernet II, Src: Intel-Hf_14:c8:00 (00:a0:c9:14:c8:00), Dst: CompalIn_81:b4:ab (XX:XX:XX:XX:XX:XX)
    Destination: CompalIn_81:b4:ab (XX:XX:XX:XX:XX:XX)
    Source: Intel-Hf_14:c8:00 (00:a0:c9:14:c8:00)
    Type: IP (0x0800)
    Trailer: 470000000000
Internet Protocol Version 4, Src: 192.168.1.153 (192.168.1.153), Dst: 192.168.1.120 (192.168.1.120)
Transmission Control Protocol, Src Port: 15977 (15977), Dst Port: http (80), Seq: 74, Ack: 2145, Len: 0

No.     Time        Source                Destination           Protocol Length Info
     17 22.196180   192.168.1.153         192.168.1.153         HTTP     328    HTTP/1.1 200 OK  (text/html)

Frame 17: 328 bytes on wire (2624 bits), 328 bytes captured (2624 bits)
Ethernet II, Src: CompalIn_81:b4:ab (XX:XX:XX:XX:XX:XX), Dst: Intel-Hf_14:c8:00 (00:a0:c9:14:c8:00)
    Destination: Intel-Hf_14:c8:00 (00:a0:c9:14:c8:00)
    Source: CompalIn_81:b4:ab (XX:XX:XX:XX:XX:XX)
    Type: IP (0x0800)
Internet Protocol Version 4, Src: 192.168.1.120 (192.168.1.120), Dst: 192.168.1.153 (192.168.1.153)
Transmission Control Protocol, Src Port: http (80), Dst Port: 15977 (15977), Seq: 4289, Ack: 74, Len: 274
[9 Reassembled TCP Segments (4562 bytes): #5(536), #6(536), #8(536), #9(536), #11(536), #12(536), #14(536), #15(536), #17(274)]
Hypertext Transfer Protocol
Line-based text data: text/html

No.     Time        Source                Destination           Protocol Length Info
     18 22.202191   192.168.1.120         192.168.1.120         TCP      60     15977 > http [ACK] Seq=74 Ack=2681 Win=16616 Len=0

Frame 18: 60 bytes on wire (480 bits), 60 bytes captured (480 bits)
Ethernet II, Src: Intel-Hf_14:c8:00 (00:a0:c9:14:c8:00), Dst: CompalIn_81:b4:ab (XX:XX:XX:XX:XX:XX)
    Destination: CompalIn_81:b4:ab (XX:XX:XX:XX:XX:XX)
    Source: Intel-Hf_14:c8:00 (00:a0:c9:14:c8:00)
    Type: IP (0x0800)
    Trailer: 470000000000
Internet Protocol Version 4, Src: 192.168.1.153 (192.168.1.153), Dst: 192.168.1.120 (192.168.1.120)
Transmission Control Protocol, Src Port: 15977 (15977), Dst Port: http (80), Seq: 74, Ack: 2681, Len: 0

No.     Time        Source                Destination           Protocol Length Info
     19 22.208433   192.168.1.120         192.168.1.120         TCP      60     15977 > http [ACK] Seq=74 Ack=3217 Win=16616 Len=0

Frame 19: 60 bytes on wire (480 bits), 60 bytes captured (480 bits)
Ethernet II, Src: Intel-Hf_14:c8:00 (00:a0:c9:14:c8:00), Dst: CompalIn_81:b4:ab (XX:XX:XX:XX:XX:XX)
    Destination: CompalIn_81:b4:ab (XX:XX:XX:XX:XX:XX)
    Source: Intel-Hf_14:c8:00 (00:a0:c9:14:c8:00)
    Type: IP (0x0800)
    Trailer: 470000000000
Internet Protocol Version 4, Src: 192.168.1.153 (192.168.1.153), Dst: 192.168.1.120 (192.168.1.120)
Transmission Control Protocol, Src Port: 15977 (15977), Dst Port: http (80), Seq: 74, Ack: 3217, Len: 0

No.     Time        Source                Destination           Protocol Length Info
     20 22.214632   192.168.1.120         192.168.1.120         TCP      60     15977 > http [ACK] Seq=74 Ack=3753 Win=16616 Len=0

Frame 20: 60 bytes on wire (480 bits), 60 bytes captured (480 bits)
Ethernet II, Src: Intel-Hf_14:c8:00 (00:a0:c9:14:c8:00), Dst: CompalIn_81:b4:ab (XX:XX:XX:XX:XX:XX)
    Destination: CompalIn_81:b4:ab (XX:XX:XX:XX:XX:XX)
    Source: Intel-Hf_14:c8:00 (00:a0:c9:14:c8:00)
    Type: IP (0x0800)
    Trailer: 470000000000
Internet Protocol Version 4, Src: 192.168.1.153 (192.168.1.153), Dst: 192.168.1.120 (192.168.1.120)
Transmission Control Protocol, Src Port: 15977 (15977), Dst Port: http (80), Seq: 74, Ack: 3753, Len: 0

No.     Time        Source                Destination           Protocol Length Info
     21 22.220829   192.168.1.120         192.168.1.120         TCP      60     15977 > http [ACK] Seq=74 Ack=4289 Win=16616 Len=0

Frame 21: 60 bytes on wire (480 bits), 60 bytes captured (480 bits)
Ethernet II, Src: Intel-Hf_14:c8:00 (00:a0:c9:14:c8:00), Dst: CompalIn_81:b4:ab (XX:XX:XX:XX:XX:XX)
    Destination: CompalIn_81:b4:ab (XX:XX:XX:XX:XX:XX)
    Source: Intel-Hf_14:c8:00 (00:a0:c9:14:c8:00)
    Type: IP (0x0800)
    Trailer: 470000000000
Internet Protocol Version 4, Src: 192.168.1.153 (192.168.1.153), Dst: 192.168.1.120 (192.168.1.120)
Transmission Control Protocol, Src Port: 15977 (15977), Dst Port: http (80), Seq: 74, Ack: 4289, Len: 0

No.     Time        Source                Destination           Protocol Length Info
     22 22.225248   192.168.1.120         192.168.1.120         TCP      60     15977 > http [FIN, ACK] Seq=74 Ack=4563 Win=16616 Len=0

Frame 22: 60 bytes on wire (480 bits), 60 bytes captured (480 bits)
Ethernet II, Src: Intel-Hf_14:c8:00 (00:a0:c9:14:c8:00), Dst: CompalIn_81:b4:ab (XX:XX:XX:XX:XX:XX)
    Destination: CompalIn_81:b4:ab (XX:XX:XX:XX:XX:XX)
    Source: Intel-Hf_14:c8:00 (00:a0:c9:14:c8:00)
    Type: IP (0x0800)
    Trailer: 470000000000
Internet Protocol Version 4, Src: 192.168.1.153 (192.168.1.153), Dst: 192.168.1.120 (192.168.1.120)
Transmission Control Protocol, Src Port: 15977 (15977), Dst Port: http (80), Seq: 74, Ack: 4563, Len: 0

No.     Time        Source                Destination           Protocol Length Info
     23 22.225362   192.168.1.153         192.168.1.153         TCP      54     http > 15977 [ACK] Seq=4564 Ack=75 Win=16616 Len=0

Frame 23: 54 bytes on wire (432 bits), 54 bytes captured (432 bits)
Ethernet II, Src: CompalIn_81:b4:ab (XX:XX:XX:XX:XX:XX), Dst: Intel-Hf_14:c8:00 (00:a0:c9:14:c8:00)
    Destination: Intel-Hf_14:c8:00 (00:a0:c9:14:c8:00)
    Source: CompalIn_81:b4:ab (XX:XX:XX:XX:XX:XX)
    Type: IP (0x0800)
Internet Protocol Version 4, Src: 192.168.1.120 (192.168.1.120), Dst: 192.168.1.153 (192.168.1.153)
Transmission Control Protocol, Src Port: http (80), Dst Port: 15977 (15977), Seq: 4564, Ack: 75, Len: 0
