No.     Time        Source                Destination           Protocol Length Info
    114 59.079387   192.168.1.153         192.168.1.153         TCP      66     49239 > http [SYN] Seq=0 Win=8192 Len=0 MSS=1460 WS=4 SACK_PERM=1

Frame 114: 66 bytes on wire (528 bits), 66 bytes captured (528 bits)
Ethernet II, Src: CompalIn_81:b4:ab (XX:XX:XX:XX:XX:XX), Dst: Intel-Hf_14:c8:00 (00:a0:c9:14:c8:00)
Internet Protocol Version 4, Src: 192.168.1.120 (192.168.1.120), Dst: 192.168.1.153 (192.168.1.153)
Transmission Control Protocol, Src Port: 49239 (49239), Dst Port: http (80), Seq: 0, Len: 0

No.     Time        Source                Destination           Protocol Length Info
    115 59.082789   192.168.1.120         192.168.1.120         TCP      60     http > 49239 [SYN, ACK] Seq=4294967158 Ack=1 Win=8192 Len=0

Frame 115: 60 bytes on wire (480 bits), 60 bytes captured (480 bits)
Ethernet II, Src: Intel-Hf_14:c8:00 (00:a0:c9:14:c8:00), Dst: CompalIn_81:b4:ab (XX:XX:XX:XX:XX:XX)
Internet Protocol Version 4, Src: 192.168.1.153 (192.168.1.153), Dst: 192.168.1.120 (192.168.1.120)
Transmission Control Protocol, Src Port: http (80), Dst Port: 49239 (49239), Seq: 4294967158, Ack: 1, Len: 0

No.     Time        Source                Destination           Protocol Length Info
    116 59.082915   192.168.1.153         192.168.1.153         TCP      54     49239 > http [ACK] Seq=1 Ack=4294967159 Win=16616 Len=0

Frame 116: 54 bytes on wire (432 bits), 54 bytes captured (432 bits)
Ethernet II, Src: CompalIn_81:b4:ab (XX:XX:XX:XX:XX:XX), Dst: Intel-Hf_14:c8:00 (00:a0:c9:14:c8:00)
Internet Protocol Version 4, Src: 192.168.1.120 (192.168.1.120), Dst: 192.168.1.153 (192.168.1.153)
Transmission Control Protocol, Src Port: 49239 (49239), Dst Port: http (80), Seq: 1, Ack: 4294967159, Len: 0

No.     Time        Source                Destination           Protocol Length Info
    117 59.083356   192.168.1.153         192.168.1.153         HTTP     351    GET / HTTP/1.1 

Frame 117: 351 bytes on wire (2808 bits), 351 bytes captured (2808 bits)
Ethernet II, Src: CompalIn_81:b4:ab (XX:XX:XX:XX:XX:XX), Dst: Intel-Hf_14:c8:00 (00:a0:c9:14:c8:00)
Internet Protocol Version 4, Src: 192.168.1.120 (192.168.1.120), Dst: 192.168.1.153 (192.168.1.153)
Transmission Control Protocol, Src Port: 49239 (49239), Dst Port: http (80), Seq: 1, Ack: 4294967159, Len: 297
Hypertext Transfer Protocol

No.     Time        Source                Destination           Protocol Length Info
    118 59.103049   192.168.1.120         192.168.1.120         TCP      60     http > 49239 [ACK] Seq=4294967159 Ack=298 Win=16616 Len=0

Frame 118: 60 bytes on wire (480 bits), 60 bytes captured (480 bits)
Ethernet II, Src: Intel-Hf_14:c8:00 (00:a0:c9:14:c8:00), Dst: CompalIn_81:b4:ab (XX:XX:XX:XX:XX:XX)
Internet Protocol Version 4, Src: 192.168.1.153 (192.168.1.153), Dst: 192.168.1.120 (192.168.1.120)
Transmission Control Protocol, Src Port: http (80), Dst Port: 49239 (49239), Seq: 4294967159, Ack: 298, Len: 0

No.     Time        Source                Destination           Protocol Length Info
    119 59.106335   192.168.1.120         192.168.1.120         TCP      192    [TCP segment of a reassembled PDU]

Frame 119: 192 bytes on wire (1536 bits), 192 bytes captured (1536 bits)
Ethernet II, Src: Intel-Hf_14:c8:00 (00:a0:c9:14:c8:00), Dst: CompalIn_81:b4:ab (XX:XX:XX:XX:XX:XX)
Internet Protocol Version 4, Src: 192.168.1.153 (192.168.1.153), Dst: 192.168.1.120 (192.168.1.120)
Transmission Control Protocol, Src Port: http (80), Dst Port: 49239 (49239), Seq: 4294967159, Ack: 298, Len: 137

No.     Time        Source                Destination           Protocol Length Info
    120 59.106554   192.168.1.153         192.168.1.153         TCP      54     49239 > http [ACK] Seq=298 Ack=1 Win=16479 Len=0

Frame 120: 54 bytes on wire (432 bits), 54 bytes captured (432 bits)
Ethernet II, Src: CompalIn_81:b4:ab (XX:XX:XX:XX:XX:XX), Dst: Intel-Hf_14:c8:00 (00:a0:c9:14:c8:00)
Internet Protocol Version 4, Src: 192.168.1.120 (192.168.1.120), Dst: 192.168.1.153 (192.168.1.153)
Transmission Control Protocol, Src Port: 49239 (49239), Dst Port: http (80), Seq: 298, Ack: 1, Len: 0

No.     Time        Source                Destination           Protocol Length Info
    121 59.106769   192.168.1.153         192.168.1.153         TCP      54     49239 > http [FIN, ACK] Seq=298 Ack=1 Win=16479 Len=0

Frame 121: 54 bytes on wire (432 bits), 54 bytes captured (432 bits)
Ethernet II, Src: CompalIn_81:b4:ab (XX:XX:XX:XX:XX:XX), Dst: Intel-Hf_14:c8:00 (00:a0:c9:14:c8:00)
Internet Protocol Version 4, Src: 192.168.1.120 (192.168.1.120), Dst: 192.168.1.153 (192.168.1.153)
Transmission Control Protocol, Src Port: 49239 (49239), Dst Port: http (80), Seq: 298, Ack: 1, Len: 0

No.     Time        Source                Destination           Protocol Length Info
    122 59.112941   192.168.1.120         192.168.1.120         TCP      60     http > 49239 [ACK] Seq=1 Ack=299 Win=16479 Len=0

Frame 122: 60 bytes on wire (480 bits), 60 bytes captured (480 bits)
Ethernet II, Src: Intel-Hf_14:c8:00 (00:a0:c9:14:c8:00), Dst: CompalIn_81:b4:ab (XX:XX:XX:XX:XX:XX)
Internet Protocol Version 4, Src: 192.168.1.153 (192.168.1.153), Dst: 192.168.1.120 (192.168.1.120)
Transmission Control Protocol, Src Port: http (80), Dst Port: 49239 (49239), Seq: 1, Ack: 299, Len: 0
